1111;DƏNLİ (ÇƏLTİK İSTİSNA OLMAQLA) BİTKİLƏRİN BECƏRİLMƏSİ
1112;PAXLALI BİTKİLƏRİN BECƏRİLMƏSİ
1113;YAĞLI BİTKİLƏRİN VƏ ONLARIN TOXUMLARININ BECƏRİLMƏSİ
1120;ÇƏLTİYİN BECƏRİLMƏSİ
1131;TƏRƏVƏZ, BOSTAN, KÖKÜMEYVƏLİ VƏ KÖKÜYUMRULARIN BECƏRİLMƏSİ
1132;ŞƏKƏR ÇUĞUNDURUNUN VƏ ONUN TOXUMUNUN BECƏRİLMƏSİ
1133;GÖBƏLƏYİN VƏ YERDOMBALANIN BECƏRİLMƏSİ
1134;KARTOFUN BECƏRİLMƏSİ
1140;ŞƏKƏR QAMIŞININ BECƏRİLMƏSİ
1150;TÜTÜNÜN BECƏRİLMƏSİ
1161;LİFLİ BİTKİLƏRİN BECƏRİLMƏSİ
1162;PAMBIĞIN BECƏRİLMƏSİ
1191;YEM BİTKİLƏRİNİN VƏ ONLARIN TOXUMLARININ BECƏRİLMƏSİ
1192;YABANI DƏRMAN BİTKİLƏRİ XAMMALININ YIĞILMASI
1193;GÜLLƏRİN VƏ ONLARIN TOXUMLARININ BECƏRİLMƏSİ
1199;DİGƏR BİRİLLİK BİTKİLƏRİN BECƏRİLMƏSİ
1210;ÜZÜMÜN BECƏRİLMƏSİ
1220;TROPİK VƏ SUBTROPİK MEYVƏLƏRİN BECƏRİLMƏSİ
1230;SİTRUS MEYVƏLƏRİN BECƏRİLMƏSİ
1241;TUMLU VƏ ÇƏYİRDƏKLİ MEYVƏLƏRİN BECƏRİLMƏSİ
1242;QOZ-FINDIQ VƏ SAİR GİLƏMEYVƏ MƏHSULLARININ BECƏRİLMƏSİ
1250;DİGƏR AĞACLARIN, KOL BİTKİLƏRİNİN VƏ QƏRZƏKLİ MEYVƏLƏRİN BECƏRİLMƏSİ
1260;YAĞLI MEYVƏLƏRİN BECƏRİLMƏSİ
1271;İÇKİ İSTEHSALI ÜÇÜN BİTKİLƏRİN BECƏRİLMƏSİ
1272;ÇAY YARPAĞININ BECƏRİLMƏSİ
1280;ƏDVİYYAT, ƏTRİYYAT VƏ DƏRMAN BİTKİLƏRİNİN BECƏRİLMƏSİ
1290;DİGƏR ÇOXİLLİK BİTKİLƏRİN BECƏRİLMƏSİ
1300;BİTKİLƏRİN ÇOXALDILMASI (ƏKİLMƏSİ)
1410;SÜDLÜK İRİBUYNUZLU MAL-QARANIN YETİŞDİRİLMƏSİ
1420;DİGƏR İRİBUYNUZLU MAL-QARANIN VƏ CAMIŞLARIN YETİŞDİRİLMƏSİ
1430;AT, EŞŞƏK VƏ QATIRLARIN YETİŞDİRİLMƏSİ
1440;DƏVƏLƏRİN VƏ MAYALARIN YETİŞDİRİLMƏSİ
1450;QOYUN VƏ KEÇİLƏRİN YETİŞDİRİLMƏSİ
1460;DONUZLARIN YETİŞDİRİLMƏSİ
1471;EV (KƏND TƏSƏRRÜFATI) QUŞLARININ YETİŞDİRİLMƏSİ
1472;YUMURTA İSTEHSALI
1491;ARILARIN BECƏRİLMƏSİ, ARI BALININ VƏ ARI MUMUNUN İSTEHSALI
1492;BARAMA QURDUNUN YETİŞDİRİLMƏSİ VƏ BARAMA İSTEHSALI
1493;XƏZ DƏRİLİ HEYVANLARIN YETİŞDİRİLMƏSİ VƏ XƏZ DƏRİ İSTEHSALI
1499;DİGƏR HEYVANLARIN YETİŞDİRİLMƏSİ
1500;HEYVANDARLIQLA ƏLAQƏLİ BİTKİÇİLİK
1611;BİTKİÇİLİK SAHƏSİNDƏ XİDMƏT GÖSTƏRİLMƏSİ
1612;İRRİQASİYA SİSTEMİNİN İSTİSMARI
1613;BİTKİÇİLİK SAHƏSİNDƏ DİGƏR XİDMƏTLƏRİN GÖSTƏRİLMƏSİ
1620;HEYVANDARLIQ SAHƏSİNDƏ XİDMƏTİN GÖSTƏRİLMƏSİ
1630;KƏND TƏSƏRRÜFATI BİTKİLƏRİ MƏHSULLARININ EMALI ÜZRƏ XİDMƏTLƏRİN GÖSTƏRİLMƏSİ
1640;ƏKİLMƏYƏ (TOXUM FONDUNUN FORMALAŞDIRILMASINA) HAZIRLIQ ÜZRƏ XİDMƏTLƏRİN GÖSTƏRİLMƏSİ
1700;OVÇULUQ VƏ VƏHŞİ HEYVANLARIN YETİŞDİRİLMƏSİ VƏ BU SAHƏLƏRDƏ XİDMƏTİN GÖSTƏRİLMƏSİ
2100;MEŞƏÇİLİK VƏ MEŞƏ TƏSƏRRÜFATI İLƏ BAĞLI SAİR FƏALİYYƏT
2200;AĞAC TƏDARÜKÜ
2301;YABANI BİTƏN QEYRİ-AĞAC MƏHSULLARININ YIĞILMASI
2302;YABANI BİTƏN MEŞƏ GÖBƏLƏKLƏRİNİN VƏ YERDOMBALANLARININ, MEYVƏLƏRİNİN, GİLƏMEYVƏLƏRİN, QOZLARIN VƏ DİGƏR YEYİLƏN MEŞƏ MƏHSULLARININ YIĞILMASI
2309;YABANI BİTƏN DİGƏR QEYRİ-AĞAC MEŞƏ MƏHSULLARININ YIĞILMASI
2400;MEŞƏ TƏSƏRRÜFATI (MEŞƏ BECƏRMƏ VƏ AĞAC TƏDARÜKÜ) SAHƏSİNDƏ XİDMƏTLƏRİN GÖSTƏRİLMƏSİ
3110;DƏNİZ BALIQÇILIĞI
3120;ÇAYLARDA, GÖLLƏRDƏ, SU ANBARLARINDA (ŞİRİN SULARDA) BALIQÇILIQ
3210;DƏNİZ BALIQYETİŞDİRİLMƏSİ
3220;ŞİRİN SU HÖVZƏLƏRİNDƏ BALIQYETİŞDİRMƏ
5100;DAŞ KÖMÜRÜN HASİLATI
5200;LİQNİTİN HASİLATI
6100;XAM NEFTİN HASİLATI
6200;TƏBİİ (YANAR) QAZ HASİLATI
7100;DƏMİR FİLİZİNİN HASİLATI
7210;URAN VƏ TORİUM FİLİZLƏRİNİN HASİLATI
7291;QİYMƏTLİ METALLARIN VƏ QİYMƏTLİ DAŞLARIN İSTEHSALI (QİYMƏTLİ METALLARIN FİLİZLƏRDƏN, KONSENTRATLARDAN ALINMASI)
7299;DİGƏR ƏLVAN METAL FİLİZLƏRİNİN HASİLATI
8111;DEKORATİV VƏ TİKİNTİ DAŞLARININ HASİLATI
8112;ƏHƏNG DAŞININ VƏ GİPSİN HASİLATI
8113;TƏBAŞIR VƏ SUSUZLAŞDIRILMAMIŞ DELOMİTİN HASİLATI
8114;ŞİST HASİLATI
8121;ÇINQIL VƏ QUMUN HASİLATI
8122;GİL VƏ KAOLİN HASİLATI
8910;KİMYA SƏNAYESİ VƏ GÜBRƏ İSTEHSALI ÜÇÜN MİNERAL XAMMAL HASİLATI
8920;TORF HASİLATI
8930;DUZ HASİLATI
8991;MƏDƏNÇIXARMA SƏNAYESİNİN DİGƏR QRUPLARINA DAXİL EDİLMƏYƏN SAİR SAHƏLƏRİ
8992;TƏBİİ ASFALT VƏ BİTUM HASİLATI
9101;NEFT VƏ TƏBİİ QAZ HASİLATI SAHƏSİNDƏ XİDMƏTLƏRİN GÖSTƏRİLMƏSİ
9102;NEFT VƏ TƏBİİ QAZIN HASİLATI ÜÇÜN QUYULARIN QAZILMASI
9900;MƏDƏNÇIXARMA SƏNAYESİNİN DİGƏR SAHƏLƏRİNDƏ XİDMƏTLƏRİN GÖSTƏRİLMƏSİ
10110;ƏT İSTEHSALI VƏ KONSERVLƏŞDİRİLMƏSİ (QUŞ ƏTİNDƏN BAŞQA)
10120;EV QUŞLARI VƏ DOVŞAN ƏTİNİN EMALI VƏ KONSERVLƏŞDİRİLMƏSİ
10131;KOLBASA, SOSİSKA, SALYAMİ, PAŞTET, BEKON VƏ SAİR ƏT MƏMULATLARININ İSTEHSALI
10132;ƏT, QUŞ VƏ EVDOVŞANI ƏTİNDƏN DİGƏR MƏMULATLARIN İSTEHSALI
10201;BALIQ MƏHSULLARININ İSTEHSALI
10202;BALIĞIN, XƏRÇƏNGKİMİLƏRİN VƏ MOLYUSKALARIN EMALI VƏ KONSERVLƏŞDİRİLMƏSİ
10311;KARTOFUN EMALI VƏ KONSERVLƏŞDİRİLMƏSİ
10312;KARTOF UNUNUN İSTEHSALI
10320;MEYVƏ VƏ TƏRƏVƏZ ŞİRƏLƏRİNİN İSTEHSALI
10391;DİGƏR QRUPLARA DAXİL EDİLMƏYƏN MEYVƏ VƏ TƏRƏVƏZLƏRİN KONSERVLƏŞDİRİLMƏSİ
10392;MEYVƏ VƏ YA TƏRƏVƏZDƏN YEYİNTİ MƏHSULLARININ İSTEHSALI
10393;CEM, MARMELAD VƏ JELENİN İSTEHSALI
10411;TƏMİZLƏNMƏMİŞ YAĞ VƏ PİYLƏRİN İSTEHSALI
10412;TƏMİZLƏNMİŞ YAĞ VƏ PİYLƏRİN İSTEHSALI
10420;MARQARİN VƏ QARIŞDIRILMIŞ YEYİNTİ PİYLƏRİNİN İSTEHSALI
10511;SÜD VƏ SÜD MƏHSULLARININ İSTEHSALI
10512;PENDİR VƏ KƏSMİK İSTEHSALI
10520;DONDURMA İSTEHSALI
10611;BUĞDA EMALI SƏNAYESİ MƏHSULLARININ İSTEHSALI
10612;DƏNLİ BİTKİLƏRDƏN UN VƏ YARMA İSTEHSALI
10620;NİŞASTA VƏ NİŞASTA MƏHSULLARININ İSTEHSALI
10710;"ÇÖRƏK İSTEHSALI; UZUN MÜDDƏT SAXLANILA BİLMƏYƏN UNLU QƏNNADI MƏMULATLARININ İSTEHSALI"
10720;SUXARI VƏ PEÇENYE İSTEHSALI, UZUN MÜDDƏT SAXLANILA BİLƏN UNLU QƏNNADI MƏMULATLARININ İSTEHSALI
10730;MAKARON, ƏRİŞTƏ VƏ OXŞAR MƏMULATLARIN İSTEHSALI
10810;ŞƏKƏR (QƏND) İSTEHSALI
10820;KAKAO, ŞOKOLAD VƏ ŞƏKƏRDƏN QƏNNADI MƏMULATLARININ İSTEHSALI
10830;ÇAY VƏ KOFE İSTEHSALI (EMALI)
10840;ƏDVİYYAT VƏ ŞİRƏLƏRİN İSTEHSALI
10850;HAZIR YEMƏKLƏRİN İSTEHSALI
10860;UŞAQ QİDALARININ VƏ PƏHRİZ ƏRZAQ MƏHSULLARININ İSTEHSALI
10890;DİGƏR QRUPLARA DAXİL EDİLMƏYƏN SAİR QİDA MƏHSULLARININ İSTEHSALI
10910;FERMALARDA SAXLANAN HEYVANLAR ÜÇÜN HAZIR YEMLƏRİN İSTEHSALI
10920;EV HEYVANLARI ÜÇÜN HAZIR YEMLƏRİN İSTEHSALI
11011;DİSTİLLƏ EDİLMİŞ VƏ TƏMİZLƏNMİŞ SPİRTLİ İÇKİLƏRİN İSTEHSALI
11012;QICQIRMA MATERİALLARINDAN ETİL SPİRTİNİN İSTEHSALI
11020;ÜZÜMDƏN ŞƏRAB İSTEHSALI
11030;SİDR VƏ BAŞQA GİLƏMEYVƏ ŞƏRABLARININ İSTEHSALI
11040;QICQIRMA MATERİALLARINDAN DİSTİLLƏ EDİLMƏMİŞ SAİR İÇKİLƏRİN İSTEHSALI
11050;PİVƏ İSTEHSALI
11060;SƏMƏNİ PİVƏSİNİN İSTEHSALI
11071;MİNERAL SULAR VƏ DİGƏR SULARIN BUTULKALARDA İSTEHSALI
11072;DİGƏR ALKOQOLSUZ İÇKİLƏRİN İSTEHSALI
12000;TÜTÜN MƏMULATLARININ İSTEHSALI
13101;PAMBIĞIN İLKİN EMALI
13102;PAMBIQ PARÇA LİFİNİN ƏYİRİLMƏSİ
13103;DARAMA MAŞININDA YUN LİFİNİN ƏYİRİLMƏSİ
13104;KAMVOL YUN LİFİNİN ƏYİRİLMƏSİ
13105;KƏTAN LİFİNİN ƏYİRİLMƏSİ
13106;TƏBİİ İPƏK, SÜNİ VƏ SİNTETİK LİFLƏRİN HAZIRLANMASI
13107;TİKİŞ SAPLARININ İSTEHSALI
13108;SAİR TOXUCULUQ LİFLƏRİNİN HAZIRLANMASI VƏ ƏYİRİLMƏSİ
13201;PAMBIQ PARÇALARIN İSTEHSALI
13202;MAŞINLA DARANIB ƏYRİLMİŞ LİFLƏRDƏN YUN PARÇALARIN İSTEHSALI
13203;EVDƏ DARANIB ƏYRİLMİŞ LİFLƏRDƏN YUN PARÇALARIN İSTEHSALI
13204;İPƏK PARÇALARIN İSTEHSALI
13300;PARÇALARIN BƏZƏDİLMƏSİ
13910;TOXUCULUQ KƏTANLARININ İSTEHSALI
13921;GEYİMDƏN BAŞQA HAZIR TOXUCULUQ MƏMULATLARININ İSTEHSALI
13922;YATAQ, YEMƏK OTAĞI, TUALET VƏ MƏTBƏX AĞLARININ İSTEHSALI
13930;XALÇA VƏ XALÇA MƏMULATLARININ İSTEHSALI
13940;KANAT (BURAZ), KƏNDİR, İP VƏ TOR İSTEHSALI
13950;TOXUNULMAYAN TOXUCULUQ MATERİALLARI VƏ ONLARDAN MƏMULATLARIN İSTEHSALI
13960;TEXNİKİ ÜSULLA HAZIRLANAN DİGƏR TOXUCULUQ MƏMULATLARININ İSTEHSALI
13990;DİGƏR QRUPLARA DAXİL EDİLMƏYƏN SAİR TOXUCULUQ MƏMULATLARININ İSTEHSALI
14110;DƏRİDƏN GEYİM İSTEHSALI
14120;XÜSUSİ (İŞ) GEYİMİN İSTEHSALI
14130;ÜST GEYİMİN İSTEHSALI
14140;ALT PALTARI İSTEHSALI
14191;BAŞ GEYİMLƏRİNİN İSTEHSALI
14199;SAİR GEYİM VƏ AKSESUARLARIN İSTEHSALI
14200;XƏZ MƏMULATLARININ İSTEHSALI
14311;TRİKOTAJ CORAB MƏMULATLARININ İSTEHSALI
14312;TRİKOTAJ PULOVERLƏRİN, CEMPERLƏRİN VƏ BUNA BƏNZƏR MƏMULATLARIN İSTEHSALI
14390;DİGƏR TRİKOTAJ MƏMULATLARININ İSTEHSALI
15110;DƏRİNİN AŞILANMASI, RƏNGLƏNMƏSİ VƏ HAZIRLANMASI
15120;DƏRİDƏN ÇAMADAN, ÇANTA VƏ DİGƏR MƏMULATLARIN İSTEHSALI
15201;GÖN-DƏRİ AYAQQABILARIN İSTEHSALI
15202;DİGƏR MATERİALLARDAN OLAN AYAQQABILARIN İSTEHSALI
16100;TAXTA-ŞALBANIN KƏSİLMƏSİ VƏ YONULMASI, ODUNCAĞIN HOPDURULMASI
16210;ŞPON, FANER VƏ AĞAC LÖVHƏLƏRİN İSTEHSALI
16220;YIĞMA PARKET DÖŞƏMƏLƏRİN İSTEHSALI
16230;AĞAC TİKİNTİ KONSTRUKSİYALARI VƏ XARRATLIQ MƏMULATLARININ İSTEHSALI
16240;TAXTA TARALARIN İSTEHSALI
16290;AĞAC VƏ MANTARDAN, NAZİK YONQARLARDAN VƏ HÖRMƏ ÜÇÜN MATERİALLARDAN SAİR MƏMULATLARIN İSTEHSALI
17110;KAĞIZ KÜTLƏSİ (SELLÜLOZ) İSTEHSALI
17120;KAĞIZ VƏ KARTON İSTEHSALI
17210;BÜZMƏLƏNMİŞ KARTON VƏ KAĞIZ, KARTON VƏ KAĞIZ TARALARIN İSTEHSALI
17220;TƏSƏRRÜFAT-MƏİŞƏT VƏ SANİTAR - GİGİYENİYA TƏYİNATLI KAĞIZ MƏMULATLARININ İSTEHSALI
17230;DƏFTƏRXANA, KAĞIZ MƏMULATLARININ İSTEHSALI
17240;DİVAR KAĞIZLARININ İSTEHSALI
17290;KAĞIZ VƏ KARTONDAN SAİR MƏMULATLARIN İSTEHSALI
18110;QƏZETLƏRİN ÇAP EDİLMƏSİ
18121;DİGƏR POLİQRAFİYA MƏHSULLARININ (QƏZETLƏRDƏN ƏLAVƏ) ÇAP EDİLMƏSİ
18122;ÇAP İŞLƏRİNİN YERİNƏ YETİRİLMƏSİ İLƏ ƏLAQƏDAR XİDMƏTLƏR
18123;BÜTÜN NÖV QİYMƏTLİ KAĞIZ BLANKLARININ HAZIRLANMASI VƏ SATIŞI ÜZRƏ FƏALİYYƏT
18124;CİDDİ HESABAT BLANKLARININ HAZIRLANMASI
18130;ÇAP İŞLƏRİNİN HAZIRLANMASI
18140;CİLDLƏMƏ VƏ BƏZƏK İŞLƏRİ
18201;SƏS YAZILARININ SURƏTİNİN ÇIXARILMASI
18202;VİDEOYAZILARIN SURƏTİNİN ÇIXARILMASI
18203;MAŞIN DAŞIYICILARININ MƏLUMATLARININ SURƏTİNİN ÇIXARILMASI
19100;KOKS İSTEHSALI
19200;TƏMİZLƏNMİŞ NEFT MƏHSULLARININ İSTEHSALI, O CÜMLƏDƏN NEFT MƏHSULLARINDAN BRİKETLƏR
20110;SƏNAYE QAZLARININ İSTEHSALI
20120;BOYAQ MADDƏLƏRİ VƏ PİQMENTLƏRİN İSTEHSALI
20130;SAİR ƏSAS QEYRİ-ÜZVİ KİMYƏVİ MADDƏLƏRİN İSTEHSALI
20140;SAİR ƏSAS ÜZVİ KİMYƏVİ MADDƏLƏRİN İSTEHSALI
20150;GÜBRƏ VƏ AZOT BİRLƏŞMƏLƏRİNİN İSTEHSALI
20160;İLKİN FORMALARDA PLASTİK KÜTLƏ İSTEHSALI
20170;İLKİN FORMADA SİNTETİK KAUÇUK İSTEHSALI
20200;AQROKİMYƏVİ MƏHSULLARIN İSTEHSALI
20300;BOYA, LAK VƏ BUNA BƏNZƏR ÖRTÜKLƏRİN, MƏTBƏƏ BOYALARININ VƏ MASTİKALARININ İSTEHSALI
20410;SABUN VƏ YUYUCU TOZLARIN, TƏMİZLƏYİCİ VƏ CİLALAYICI VASİTƏLƏRİN İSTEHSALI
20420;ƏTRİYYAT VƏ KOSMETİKA VASİTƏLƏRİNİN İSTEHSALI
20510;PARTLAYICI MADDƏLƏRİN İSTEHSALI
20520;YAPIŞQAN İSTEHSALI
20530;EFİR YAĞLARININ İSTEHSALI
20591;FOTOMATERİALLARIN İSTEHSALI
20599;DİGƏR QRUPLARA DAXİL EDİLMƏMİŞ SAİR KİMYƏVİ MƏHSULLARIN İSTEHSALI
20600;SÜNİ VƏ SİNTETİK KİMYƏVİ LİFLƏRİN İSTEHSALI
21100;ƏSAS ƏCZAÇILIQ MƏHSULLARININ İSTEHSALI
21200;ƏCZAÇILIQ PREPARATLARININ VƏ MATERİALLARININ İSTEHSALI
22110;REZİN ŞİN, TƏKƏR VƏ KAMERALARIN İSTEHSALI VƏ BƏRPASI
22191;REZİNDƏN SƏNAYE TƏYİNATLI MƏHSULLARIN VƏ YARIMFABRİKATLARIN İSTEHSALI
22192;REZİN MƏMULATLARIN İSTEHSALI
22193;MÜXTƏLİF NÖV MÖHÜRLƏRİN VƏ ŞTAMPLARIN HAZIRLANMASI
22210;PLASTİK LÖVHƏLƏRİN, ZOLAQLARIN, BORULARIN, PROFİLLƏRİN İSTEHSALI
22220;ƏMTƏƏLƏRİN QABLAŞDIRILMASI ÜÇÜN PLASTİK MƏMULATLARIN İSTEHSALI
22230;TİKİNTİDƏ İSTİFADƏ EDİLƏN PLASTİK KÜTLƏDƏN MƏMULATLARIN İSTEHSALI
22290;SAİR PLASTİK MƏMULATLARIN İSTEHSALI
23110;ŞÜŞƏ TƏBƏQƏSİNİN İSTEHSALI
23120;ŞÜŞƏ TƏBƏQƏSİNİN FORMALAŞDIRILMASI VƏ EMALI
23130;İÇİBOŞ ŞÜŞƏ MƏMULATLARININ İSTEHSALI
23140;ŞÜŞƏ LİFİN İSTEHSALI
23190;TEXNİKİ ŞÜŞƏ MƏMULATLARI DAXİL OLMAQLA SAİR ŞÜŞƏ MƏMULATLARIN İSTEHSALI VƏ EMALI
23200;ODADAVAMLI MƏMULATLARIN İSTEHSALI
23310;SAXSI LÖVHƏCİKLƏRİN VƏ LÖVHƏLƏRİN İSTEHSALI
23320;KƏRPİC, KİRƏMİT VƏ YANDIRILMIŞ GİLDƏN SAİR TİKİNTİ MƏMULATLARININ İSTEHSALI
23410;TƏSƏRRÜFAT VƏ DEKORATİV SAXSI MƏMULATLARIN IN İSTEHSALI
23420;SAXSI SANİTAR - TEXNİKİ MƏMULATLARIN İSTEHSALI
23430;SAXSI İZOLYATORLARIN VƏ SAXSI İZOLYASİYA ARMATURUNUN İSTEHSALI
23440;SAİR TEXNİKİ SAXSI MƏMULATLARIN İSTEHSALI
23490;SAİR SAXSI MƏMULATLARIN İSTEHSALI
23510;SEMENT İSTEHSALI
23520;ƏHƏNG VƏ GİPS İSTEHSALI
23610;TİKİNTİDƏ İSTİFADƏ ETMƏK ÜÇÜN BETONDAN MƏMULATLARIN İSTEHSALI
23620;TİKİNTİDƏ İSTİFADƏ ETMƏK ÜÇÜN GİPS MƏMULATLARININ İSTEHSALI
23630;ƏMTƏƏ BETONUNUN İSTEHSALI (HAZIR BETON QARIŞIĞI)
23640;QURU BETON QATIŞIĞININ İSTEHSALI
23650;LİFLİ SEMENTDƏN (AZBESTSEMENTDƏN) MƏMULATLARIN İSTEHSALI
23690;BETON, GİPS VƏ SEMENTDƏN SAİR MƏMULATLARIN İSTEHSALI
23700;DEKORATİV VƏ TİKİNTİ DAŞLARININ KƏSİLMƏSİ, EMALI VƏ NAXIŞLANMASI
23910;ABRAZİV MƏMULATLARIN İSTEHSALI
23990;DİGƏR QRUPLARA DAXİL EDİLMƏYƏN SAİR QEYRİ-METAL MİNERAL MƏHSULLARIN İSTEHSALI
24100;ÇUQUN, POLAD VƏ FERROƏRİNTİ İSTEHSALI
24200;POLADDAN BORU, İÇİ BOŞ PROFİLLƏR VƏ BİRLƏŞDİRİCİ HİSSƏLƏRİN İSTEHSALI
24310;SOYUQ DARTMA
24320;ENSİZ ZOLAQLARIN VƏ LENTLƏRİN SOYUQ YAYILMASI
24330;MƏHSULLARIN SOYUQ ŞƏKİLDƏ ŞTAMPLANMASI VƏ ƏYİLMƏSİ
24340;MƏFTİL İSTEHSALI
24410;NƏCİB (QİYMƏTLİ) METALLARIN İSTEHSALI
24420;ALÜMİNİUM İSTEHSALI
24430;QURĞUŞUN, SİNK VƏ QALAY İSTEHSALI
24440;MİS İSTEHSALI
24450;SAİR ƏLVAN METALLARIN İSTEHSALI
24460;NÜVƏ YANACAĞININ EMALI
24510;ÇUQUN TÖKMƏ
24520;POLAD TÖKMƏ
24530;YÜNGÜL METALLARIN TÖKÜLMƏSİ
24540;SAİR ƏLVAN METALLARIN TÖKÜLMƏSİ
25110;METALDAN TİKİNTİ KONSTRUKSİYALARI VƏ ONLARIN HİSSƏLƏRİNİN İSTEHSALI
25120;METAL QAPI VƏ PƏNCƏRƏLƏRİN İSTEHSALI
25210;MƏRKƏZİ İSTİLİK RADİATORLARININ VƏ QAZANLARININ İSTEHSALI
25290;METALDAN SAİR SİSTERNLƏRİN, ÇƏNLƏRİN VƏ KONTEYNERLƏRİN İSTEHSALI
25300;MƏRKƏZİ İSTİLİK QAZANLARINDAN BAŞQA BUXAR QAZANLARININ İSTEHSALI
25400;SİLAH VƏ HƏRBİ SURSAT İSTEHSALI
25500;METALIN DÖYÜLMƏSİ, PRESLƏNMƏSİ, ŞTAMPLANMASI VƏ PROFİLLƏNMƏSİ, TOZ METALLURGİYASI
25610;METALLARIN EMALI VƏ METALLARA ÖRTÜK ÇƏKİLMƏSİ
25620;MAŞINQAYIRMANIN ƏSAS TEXNOLOJİ PROSESLƏRİ
25710;BIÇAQ MƏMULATLARININ İSTEHSALI
25720;QIFIL VƏ HƏNCAMA İSTEHSALI
25730;ALƏTLƏRİN İSTEHSALI
25910;METAL ÇƏLLƏKLƏRİN VƏ BUNA BƏNZƏR TUTUMLULARIN İSTEHSALI
25920;YÜNGÜL METALLARDAN QABLAŞDIRMA MATERİALLARININ İSTEHSALI
25930;MƏFTİL MƏMULATLARININ İSTEHSALI
25940;BƏRKİDİCİ MƏMULATLARIN, ZƏNCİRLƏRİN VƏ YAYLARIN İSTEHSALI
25990;SAİR HAZIR METAL MƏMULATLARININ İSTEHSALI
26110;ELEKTRON DETALLARININ İSTEHSALI
26120;ELEKTRON PLATALARININ İSTEHSALI
26200;KOMPÜTERLƏRİN VƏ PERİFERİYA QURĞULARININ İSTEHSALI
26301;ELEKTRO VƏ RADİOELEMENTLƏRİN İSTEHSALI
26302;ÖTÜRÜCÜ CİHAZLARIN İSTEHSALI
26303;SƏSİ VƏ TƏSVİRİ QƏBUL ETMƏK, YAZMAQ VƏ GÖSTƏRMƏK ÜÇÜN CİHAZLARIN İSTEHSALI
26304;ƏMƏLİYYAT-AXTARIŞ FƏALİYYƏTİNİN HƏYATA KEÇİRİLMƏSİNƏ MÜVƏKKİL EDİLMƏMİŞ HÜQUQİ VƏ FİZİKİ ŞƏXSLƏR TƏRƏFİNDƏN QEYRİ LEQAL YOLLA İNFORMASİYA ALINMASI ÜÇÜN NƏZƏRDƏ TUTULMUŞ TEXNİKİ VASİTƏLƏRİN İŞLƏNİLMƏSİ, İSTEHSALI
26400;MƏİŞƏT ELEKTRON AVADANLIQLARININ İSTEHSALI
26510;NƏZARƏT-ÖLÇÜ CİHAZLARININ İSTEHSALI
26520;BÜTÜN NÖVLƏRDƏN OLAN SAATLARIN İSTEHSALI
26600;ŞUALANDIRMA, ELEKTRİK TİBB VƏ ELEKTROTERAPİYA AVADANLIQLARI
26700;OPTİK CİHAZLARIN VƏ FOTOAVADANLIQLARIN İSTEHSALI
26800;MAQNİT VƏ OPTİK DAŞIYICILARIN İSTEHSALI
27111;ELEKTRİK MÜHƏRRİKLƏRİNİN, GENERATORLARININ VƏ TRANSFORMATORLARIN İSTEHSALI
27112;ELEKTRİK MÜHƏRRİKLƏRİNİN, GENERATORLARININ VƏ TRANSFORMATORLARININ TƏMİRİ
27120;ELEKTRİK PAYLAYICI VƏ TƏNZİMLƏYİCİ CİHAZLARININ İSTEHSALI
27200;BATAREYALARIN VƏ AKKUMULYATORLARIN İSTEHSALI
27310;OPTİK LİFLƏRDƏN KABEL İSTEHSALI
27320;DİGƏR ELEKTRON VƏ ELEKTRİK NAQİLLƏRİNİN VƏ KABELLƏRİN İSTEHSALI
27330;ELEKTRİK ŞƏBƏKƏLƏRİ ÜÇÜN CİHAZLARIN İSTEHSALI
27400;ELEKTRİK LAMPALARI VƏ İŞIQLANDIRICI AVADANLIQLARIN İSTEHSALI
27511;ELEKTRİK MƏİŞƏT CİHAZLARININ İSTEHSALI
27512;ELEKTRİK QIZDIRICI MƏİŞƏT CİHAZLARININ İSTEHSALI
27520;QEYRİ-ELEKTRİK MƏİŞƏT CİHAZLARININ İSTEHSALI
27900;SAİR ELEKTRİK AVADANLIQLARININ İSTEHSALI
28110;TƏYYARƏ, AVTOMOBİL VƏ MOTOSİKLET MÜHƏRRİKLƏRİNDƏN BAŞQA, MÜHƏRRİKLƏRİN VƏ TURBİNLƏRİN İSTEHSALI
28120;HİDRAVLİK VƏ PNEVMATİK SİSTEMLƏRİN İSTEHSALI
28130;NASOS VƏ KOMPRESSORLARIN İSTEHSALI
28140;KRAN VƏ KLAPANLARIN İSTEHSALI
28150;ÖTÜRÜCÜLƏRİN VƏ MEXANİKİ ÖTÜRÜCÜ ELEMENTLƏRİN, DİŞLİ ÖTÜRÜCÜLƏRİN VƏ YASTIQLARIN İSTEHSALI
28210;SOBALAR VƏ SOBA ODLUQLARININ İSTEHSALI
28220;QALDIRICI NƏQLİYYAT AVADANLIĞININ İSTEHSALI
28230;KOMPÜTER VƏ PEREFERİYA AVADANLIQLARINDAN BAŞQA OFİS AVADANLIQLARININ İSTEHSALI
28240;MEXANİKİ ÖTÜRÜCÜLÜ CİHAZLARIN İSTEHSALI
28250;QEYRİ-MƏİŞƏT SOYUDUCULARI VƏ VENTİLYASİYA AVADANLIQLARININ İSTEHSALI
28290;DİGƏR QRUPLARA DAXİL EDİLMƏYƏN ÜMUMİ TƏYİNATLI SAİR MAŞIN VƏ AVADANLIQLARIN İSTEHSALI
28301;KƏND VƏ MEŞƏ TƏSƏRRÜFATI TRAKTORLARININ VƏ ONLARA HİSSƏLƏRİN İSTEHSALI
28302;KƏND TƏSƏRRÜFATI VƏ MEŞƏ TƏSƏRRÜFATI TRAKTORLARININ TƏMİRİ DƏZGAHLARIN İSTEHSALI
28410;METALKƏSİCİ AVADANLIQLARIN İSTEHSALI - 3 sav
28490;SAİR DƏZGAHLARIN İSTEHSALI
28911;METALLURGİYA ÜÇÜN MAŞIN VƏ AVADANLIQLARIN İSTEHSALI
28912;METALLURGİYA ÜÇÜN MAŞIN VƏ AVADANLIQLARIN TƏMİRİ
28920;DAĞ-MƏDƏN ÇIXARMA, NEFTÇIXARMA SƏNAYESİ, KARXANA İŞLƏRİ VƏ TİKİNTİ ÜÇÜN MAŞIN VƏ AVADANLIQLARIN İSTEHSALI
28930;İÇKİ VƏ TÜTÜN MƏMULATLARI DA DAXİL OLMAQLA QİDA MƏHSULLARININ HAZIRLANMASI ÜÇÜN MAŞIN VƏ AVADANLIQLARIN İSTEHSALI
28940;TOXUCULUQ, TİKİŞ, XƏZ VƏ DƏRİ MƏMULATLARININ HAZIRLANMASI ÜÇÜN MAŞIN VƏ AVADANLIQLARIN İSTEHSALI
28950;KAĞIZ VƏ KARTONUN HAZIRLANMASI ÜÇÜN MAŞIN VƏ AVADANLIQLARIN İSTEHSALI
28960;PLASTİK KÜTLƏ VƏ REZİNİN EMALI ÜÇÜN MAŞIN VƏ AVADANLIQLARIN İSTEHSALI
28991;DİGƏR QRUPLARA DAXİL EDİLMƏYƏN XÜSUSİ TƏYİNATLI SAİR MAŞIN VƏ AVADANLIQLARIN İSTEHSALI
28992;YANĞINSÖNDÜRMƏ LƏVAZİMATININ, İLKİN YANĞINSÖNDÜRMƏ VASİTƏLƏRİNİN TƏMİRİ VƏ ONLARA XİDMƏT, YANĞINSÖNDÜRMƏ VASİTƏLƏRİNİN KEYFİYYƏTİNİN BƏRPASI
29101;AVTOMOBİLLƏRİN İSTEHSALI
29102;YANĞINSÖNDÜRMƏ TEXNİKASI MƏHSULUNUN İSTEHSALI VƏ ALINMASI, SINAQLARIN KEÇİRİLMƏSİ
29103;AVTOMOBİL MÜHƏRRİKLƏRİNİN İSTEHSALI
29200;AVTOMOBİLLƏR ÜÇÜN GÖVDƏLƏRİN (KUZOVLARIN) İSTEHSALI, QOŞQU VƏ YARIMQOŞQULARIN İSTEHSALI
29310;AVTOMOBİLLƏR ÜÇÜN ELEKTRON VƏ ELEKTRİK AVADANLIQLARININ İSTEHSALI
29320;AVTOMOBİLLƏR ÜÇÜN DİGƏR HİSSƏLƏRİN VƏ LƏVAZİMATLARIN İSTEHSALI
30110;GƏMİLƏRİN VƏ ÜZƏN QURĞULARIN QAYIRILMASI
30120;TURİST- İDMAN GƏMİLƏRİNİN QAYIRILMASI
30200;DƏMİR YOLU NƏQLİYYATI VASİTƏLƏRİNİN İSTEHSALI
30300;KOSMİK APARATLAR DA DAXİL OLMAQLA UÇAN APARATLARIN İSTEHSALI
30400;HƏRBİ AVTOMOBİLLƏRİN İSTEHSALI
30910;MOTOSİKLETLƏRİN İSTEHSALI
30920;VELOSİPEDLƏRİN VƏ ƏLİL ARABALARININ, ONLARA HİSSƏLƏRİN İSTEHSALI
30990;DİGƏR QRUPLARA DAXİL EDİLMƏYƏN SAİR NƏQLİYYAT VASİTƏLƏRİ VƏ AVADANLIQLARININ İSTEHSALI
31010;OFİS VƏ TİCARƏT MÜƏSSİSƏLƏRİ ÜÇÜN MEBELLƏRİN İSTEHSALI
31020;MƏTBƏX MEBELLƏRİNİN İSTEHSALI
31030;DÖŞƏKLƏRİN İSTEHSALI
31090;SAİR MEBELLƏRİN İSTEHSALI
32110;SİKKƏLƏRİN VƏ MEDALLARIN KƏSİLMƏSİ
32120;ZƏRGƏRLİK MƏMULATLARININ İSTEHSALI
32130;AZQİYMƏTLİ MATERİALLARDAN ZƏRGƏRLİK MƏMULATININ İSTEHSALI (SÜNİ DAŞ-QAŞLARIN) İSTEHSALI
32200;MUSİQİ ALƏTLƏRİNİN İSTEHSALI
32300;İDMAN MALLARININ İSTEHSALI
32400;OYUN VƏ OYUNCAQLARIN İSTEHSALI
32500;TİBBİ VƏ STOMOTOLOGİYA PRAKTİKASINDA TƏTBİQ OLUNAN ALƏTLƏRİN İSTEHSALI
32910;SÜPÜRGƏ VƏ ŞOTKA İSTEHSALI
32990;DİGƏR QRUPLARA DAXİL EDİLMƏYƏN SAİR MƏHSULLARIN İSTEHSALI
33110;HAZIR METAL MƏMULATLARININ TƏMİRİ
33120;MAŞIN VƏ AVADANLIQLARIN TƏMİRİ
33130;ELEKTRON VƏ OPTİK AVADANLIQLARIN TƏMİRİ
33140;ELEKTRİK AVADANLIQLARININ TƏMİRİ
33150;GƏMİLƏRİN TƏMİRİ VƏ ONLARA TEXNİKİ XİDMƏT
33160;KOSMİK APARATLAR DA DAXİL OLMAQLA UÇUŞ APARATLARININ TƏMİRİ VƏ ONLARA TEXNİKİ XİDMƏT
33170;DİGƏR NƏQLİYYAT VASİTƏLƏRİNİN TƏMİRİ VƏ ONLARA TEXNİKİ XİDMƏT
33190;DİGƏR AVADANLIQLARIN TƏMİRİ
33200;SƏNAYE MAŞIN VƏ AVADANLIQLARININ QURAŞDIRILMASI
35110;ELEKTRİK ENERJİSİNİN İSTEHSALI
35120;ELEKTRİK ENERJİSİNİN ÖTÜRÜLMƏSİ
35130;ELEKTRİK ENERJİSİNİN BÖLÜŞDÜRÜLMƏSİ
35140;ELEKTRİK ENERJİSİNİN SATIŞI
35210;QAZIN İSTEHSALI
35220;QAZABƏNZƏR YANACAĞIN QAZ TƏCHİZATI ŞƏBƏKƏLƏRİ VASİTƏSİLƏ BÖLÜŞDÜRÜLMƏSİ
35231;QAZABƏNZƏR YANACAĞIN QAZ TƏCHİZATI ŞƏBƏKƏLƏRİ VASİTƏSİLƏ SATIŞI
35232;QAZ MƏHSULLARININ SATIŞI
35300;BUXAR VƏ KONDİSİYALANMIŞ HAVA İLƏ TƏCHİZAT
36000;SUYUN YIĞILMASI, TƏMİZLƏNMƏSİ VƏ PAYLANMASI .
37000;ÇİRKLİ SULARIN YIĞILMASI VƏ EMALI
38110;TƏHLÜKƏSİZ TULLANTILARIN YIĞILMASI
38120;TƏHLÜKƏLİ TULLANTILARIN YIĞILMASI
38210;TƏHLÜKƏSİZ TULLANTILARIN EMALI VƏ LƏĞV EDİLMƏSİ
38220;TƏHLÜKƏLİ TULLANTILARIN EMALI VƏ LƏĞV EDİLMƏSİ
38310;SINIQ ƏŞYALARIN SÖKÜLMƏSİ
38320;ÇEŞİDLƏŞDİRİLMİŞ MATERİALLARDAN BAŞQA MƏQSƏDLƏ İSTİFADƏ EDİLMƏSİ (TƏKRAR XAMMALIN ALINMASI)
39001;DİGƏR TULLANTILARIN YIĞILMASI VƏ MƏHV EDİLMƏSİ
39002;SANİTAR, DƏRMAN VƏ OXŞAR XİDMƏTLƏR
39003;RADİOAKTİV VƏ İONİZƏ ŞÜALARI VERƏN MADDƏLƏRİN TULLANTILARININ SAXLANMASI VƏ BASDIRILMASI
39004;TOKSİKİ İSTEHSALAT TULLANTILARININ ÜTİLİZASİYASI VƏ ZƏRƏRSİZLƏŞDİRİLMƏSİ
39005;ƏLVAN METAL, TƏRKİBİNDƏ QİYMƏTLİ METALLAR VƏ DAŞLAR OLAN SƏNAYE VƏ İSTEHSALAT TULLANTILARININ TƏDARÜKÜ, EMALI VƏ SATIŞI
41100;TƏCRÜBƏ-TİKİNTİ İŞLƏRİ
41200;YAŞAYIŞ VƏ QEYRİ-YAŞAYIŞ BİNALARININ TİKİNTİSİ
41202;MƏNZİL TİKİNTİSİ
42110;AVTOMOBİL YOLLARI, YOLLAR VƏ KÜÇƏLƏRİN SALINMASI
42120;DƏMİR YOLLARI VƏ YERALTI DƏMİR YOLLARININ TİKİNTİSİ
42131;KÖRPÜ VƏ TUNELLƏRİN TİKİNTİSİ
42132;MAYE VƏ TƏBİİ QAZ TƏSƏRRÜFATI OBYEKTLƏRİNİN QURAŞDIRILMASI VƏ İSTİSMARI
42133;ENERGETİKA OBYEKTLƏRİNİN, AVADANLIQLARIN VƏ QURĞULARIN QURAŞDIRILMASI, SAZLANMASI VƏ TƏMİRİ
42134;YANĞINDAN MÜHAFİZƏ BİNALARININ, QURĞULARININ, OTAQLARININ TİKİLMƏSİ, YENİDƏN QURULMASI VƏ TƏMİRİ
42210;BORU KƏMƏRLƏRİNİN TİKİNTİSİ
42220;RABİTƏ VƏ ELEKTRİK XƏTLƏRİNİN ÇƏKİLMƏSİ
42910;SU QURĞULARININ TİKİNTİSİ
42990;DİGƏR MÜLKÜ TİKİNTİLƏR
43111;BİNALARIN SÖKÜLMƏSİ
43112;DAĞ-MƏDƏN İŞLƏRİ, DAĞ VƏ BURUQ QAZMALARININ APARILMASI
43120;TİKİNTİ SAHƏSİNİN HAZIRLANMASI
43130;KƏŞFİYYAT QAZINTISI
43211;ELEKTRİK QURAŞDIRMA İŞLƏRİ
43212;LİFT VƏ ESKALATORLARIN QURAŞDIRILMASI
43213;YANĞINDAN MÜHAFİZƏ SİSTEMLƏRİNİN VƏ VASİTƏLƏRİNİN QURAŞDIRILMASI, TEXNİKİ XİDMƏTİ VƏ TƏMİRİ
43221;SANİTAR-TEXNİKİ İŞLƏRİ, İSTİLİK VƏ HAVANIN KONDİSİYALANDIRILMASI SİSTEMLƏRİNİN QURAŞDIRILMASI
43222;AVTOMATİK YANĞINSÖNDÜRMƏ SİSTEMLƏRİ
43290;SAİR MÜHƏNDİS AVADANLIQLARININ QURAŞDIRILMASI
43310;SUVAQ İŞLƏRİ
43320;XARRATLIQ VƏ DÜLGƏRLİK İŞLƏRİ
43330;DÖŞƏMƏ ÖRTÜYÜNÜN QURULMASI VƏ DİVARA ÖRTÜYÜN ÇƏKİLMƏSİ
43340;RƏNGLƏMƏ VƏ ŞÜŞƏ SALMA İŞLƏRİ
43390;SAİR BƏZƏK VƏ TAMAMLAYICI TİKİNTİ İŞLƏRİ
43910;BİNA VƏ TİKİLİLƏRİN ÖRTÜKLƏRİNİN QURAŞDIRILMASI
43990;DİGƏR QRUPLARA DAXİL EDİLMƏYƏN İXTİSASLAŞDIRILMIŞ TİKİNTİ İŞLƏRİ
45111;AVTOMOBİLLƏRİN VƏ MİNİK AVTOMOBİL VASİTƏLƏRİNİN TOPDAN SATIŞI
45112;AVTOMOBİLLƏRİN VƏ MİNİK AVTOMOBİL VASİTƏLƏRİNİN PƏRAKƏNDƏ SATIŞI
45190;SAİR AVTOMOBİL VASİTƏLƏRİNİN SATIŞI
45200;AVTOMOBİLLƏRƏ TEXNİKİ XİDMƏT GÖSTƏRİLMƏSİ VƏ ONLARIN TƏMİRİ
45310;AVTOMOBİLLƏR ÜÇÜN HİSSƏLƏRİN, QOVŞAQLARIN VƏ LƏVAZİMATLARIN TOPDAN SATIŞI
45320;AVTOMOBİLLƏR ÜÇÜN HİSSƏLƏRİN, QOVŞAQLARIN VƏ LƏVAZİMATLARIN PƏRAKƏNDƏ SATIŞI
45400;MOTOSİKLETLƏRİN, ONLARIN HİSSƏLƏRİNİN, QOVŞAQLARININ VƏ LƏVAZİMATLARININ SATIŞI, MOTOSİKLETLƏRƏ TEXNİKİ XİDMƏT VƏ TƏMİRİ
46110;KƏND TƏSƏRRÜFATI XAMMALLARININ, DİRİ HEYVANLARIN, TOXUCULUQ XAMMALININ VƏ YARIMFABRİKATLARIN TOPDAN SATIŞI ÜZRƏ AGENTLİK FƏALYYƏTİ
