96030;DƏFN MƏRASİMLƏRİNİN TƏŞKİLİ VƏ BUNUNLA ƏLAQƏDAR XİDMƏTLƏRİN GÖSTƏRİLMƏSİ
96040;FİZİKİ RAHATLIĞIN TƏMİN EDİLMƏSİ ÜZRƏ FƏALİYYƏT
96090;DİGƏR QRUPLARA DAXİL EDİLMƏYƏN SAİR FƏRDİ XİDMƏTLƏRİN GÖSTƏRİLMƏSİ
97000;MUZDLU İŞÇİLƏRLƏ ŞƏXSİ EV TƏSƏRRÜFATLARININ FƏALİYYƏTİ
97002;MUZDLU İŞƏ GÖRƏ ƏMƏK HAQQINDAN GƏLİR VERGİSİ ÖDƏYƏN FİZİKİ ŞƏXS
98100;ŞƏXSİ EV TƏSƏRRÜFATINDA FƏRDİ İSTEHLAK ÜÇÜN İSTEHSAL EDİLƏN MƏHSULLAR VƏ GÖSTƏRİLƏN XİDMƏTLƏR
98200;EV TƏSƏRRÜFATLARI TƏRƏFİNDƏN ŞƏXSİ İSTEHLAK ÜÇÜN MÜXTƏLİF XİDMƏTLƏRİN GÖSTƏRİLMƏSİ
99000;TOXUNULMAZLIQ HÜQUQU OLAN TƏŞKİLATLARIN FƏALİYYƏTİ
99911;BİTKİÇİLİK